{
  "format_version": "0.1-draft",
  "turn": "turn-producer-boundary-succeeded-001",
  "inferences": [
    {
      "id": "inference-boundary-succeeded-001",
      "actual_request_utf8": "Find the latest customer note.",
      "routing": {
        "outcome": "invoked",
        "bound": "model:example/atlas-4@2026-08-01"
      }
    }
  ],
  "boundaries": [{ "id": "boundary-succeeded-001", "outcome": "succeeded" }],
  "external_artifacts": []
}
