{
  "format_version": "0.1-draft",
  "turn": "turn-producer-fallback-001",
  "inferences": [
    {
      "id": "inference-fallback-001",
      "actual_request_utf8": "Summarize the customer notes.",
      "routing": {
        "outcome": "invoked",
        "bound": "model:example/atlas-mini@2026-08-01"
      }
    }
  ],
  "boundaries": [],
  "external_artifacts": []
}
